{
  "actor": {
    "agent": "AmpgentResearch",
    "instance": "p18-a",
    "platform": "github-actions",
    "role": "producer"
  },
  "attempt_id": "attempt-0001",
  "extensions": {
    "aosw": {
      "attempt_count": 1,
      "current_task_status": "CLAIMED",
      "derived_from_event_seq": 8,
      "error": {
        "class": "review_revise",
        "correction": "missing_url"
      },
      "retry": null
    }
  },
  "graph_revision": "g0001",
  "input_refs": [],
  "output_refs": [],
  "run_id": "run-001",
  "schema_version": "1.0.0",
  "started_at": "2026-10-20T21:09:30Z",
  "status": "running",
  "task_id": "collect"
}
