{
  "actor": {
    "agent": "AmpgentResearch",
    "instance": "p18-a",
    "platform": "github-actions",
    "role": "producer"
  },
  "attempt_id": "attempt-0001",
  "extensions": {
    "aosw": {
      "attempt_count": 1,
      "current_task_status": "COMPLETE",
      "derived_from_event_seq": 57,
      "error": null,
      "retry": null
    }
  },
  "graph_revision": "g0001",
  "input_refs": [],
  "output_refs": [
    {
      "artifact_id": "prelaunch-record",
      "locator": "artifacts/prelaunch.md",
      "revision": "v1",
      "sha256": "2dd1e97e78d46031e3e719462132b35ca869242acd38dcd95785c82965e4c995"
    }
  ],
  "run_id": "run-001",
  "schema_version": "1.0.0",
  "started_at": "2026-10-20T21:05:46Z",
  "status": "succeeded",
  "task_id": "prelaunch"
}
