{
  "actor": {
    "agent": "AmpgentResearch",
    "instance": "p18-a",
    "platform": "github-actions",
    "role": "producer"
  },
  "attempt_id": "attempt-0001",
  "extensions": {
    "aosw": {
      "attempt_count": 1,
      "current_task_status": "COMPLETE",
      "derived_from_event_seq": 57,
      "error": null,
      "retry": null
    }
  },
  "graph_revision": "g0001",
  "input_refs": [],
  "output_refs": [
    {
      "artifact_id": "copy-record",
      "locator": "artifacts/copy.md",
      "revision": "v1",
      "sha256": "0b283371515f0b3cb2cf65beafc8b71d302455736ef70845eb13fd21ea1c62d4"
    }
  ],
  "run_id": "run-001",
  "schema_version": "1.0.0",
  "started_at": "2026-10-20T21:05:45Z",
  "status": "succeeded",
  "task_id": "copy"
}
