{
  "actor": {
    "agent": "ColdResume",
    "instance": "p18-c",
    "platform": "file-replay",
    "role": "worker"
  },
  "attempt_id": "attempt-0002",
  "extensions": {
    "aosw": {
      "attempt_count": 2,
      "current_task_status": "COMPLETE",
      "derived_from_event_seq": 13,
      "error": {
        "class": "review_revise",
        "correction": "missing_url"
      },
      "retry": null
    }
  },
  "graph_revision": "g0001",
  "input_refs": [],
  "output_refs": [
    {
      "artifact_id": "collect-record",
      "locator": "artifacts/collect.json",
      "revision": "v2",
      "sha256": "e5f0160d0941b588f63aedcc1c5e2f359f6559d4eb59d4b0b5dac0432e0b9618"
    }
  ],
  "run_id": "run-001",
  "schema_version": "1.0.0",
  "started_at": "2026-10-20T21:09:30Z",
  "status": "succeeded",
  "task_id": "collect"
}
