{
  "actor": {
    "agent": "AmpgentResearch",
    "instance": "p18-a",
    "platform": "github-actions",
    "role": "producer"
  },
  "attempt_id": "attempt-0001",
  "extensions": {
    "aosw": {
      "attempt_count": 1,
      "current_task_status": "COMPLETE",
      "derived_from_event_seq": 57,
      "error": null,
      "retry": null
    }
  },
  "graph_revision": "g0001",
  "input_refs": [],
  "output_refs": [
    {
      "artifact_id": "fanout-record",
      "locator": "artifacts/fanout.md",
      "revision": "v1",
      "sha256": "2639c9ce6fc4ce79877c789f6e479aee285f3c59c199a9ff7cf693074f20e22f"
    }
  ],
  "run_id": "run-001",
  "schema_version": "1.0.0",
  "started_at": "2026-10-20T21:05:45Z",
  "status": "succeeded",
  "task_id": "fanout"
}
