{
  "actor": {
    "agent": "AmpgentResearch",
    "instance": "p18-a",
    "platform": "github-actions",
    "role": "producer"
  },
  "attempt_id": "attempt-0001",
  "extensions": {
    "aosw": {
      "attempt_count": 1,
      "current_task_status": "COMPLETE",
      "derived_from_event_seq": 57,
      "error": null,
      "retry": null
    }
  },
  "graph_revision": "g0001",
  "input_refs": [],
  "output_refs": [
    {
      "artifact_id": "synthesis-record",
      "locator": "artifacts/synthesis.md",
      "revision": "v1",
      "sha256": "047d5416f44a058992dbcdcb65ca759397aec260235f03b721a47cc854be3aba"
    }
  ],
  "run_id": "run-001",
  "schema_version": "1.0.0",
  "started_at": "2026-10-20T21:09:30Z",
  "status": "succeeded",
  "task_id": "synthesis"
}
