{
  "actor": {
    "agent": "AmpgentResearch",
    "instance": "p18-a",
    "platform": "github-actions",
    "role": "producer"
  },
  "attempt_id": "attempt-0001",
  "extensions": {
    "aosw": {
      "attempt_count": 1,
      "current_task_status": "COMPLETE",
      "derived_from_event_seq": 57,
      "error": null,
      "retry": null
    }
  },
  "graph_revision": "g0001",
  "input_refs": [],
  "output_refs": [
    {
      "artifact_id": "crm-record",
      "locator": "artifacts/crm.md",
      "revision": "v1",
      "sha256": "d4198353c84d1c1ebf7b78cfd1db4a0026d17d6cde293f33058539bd9bca2ec4"
    }
  ],
  "run_id": "run-001",
  "schema_version": "1.0.0",
  "started_at": "2026-10-20T21:09:30Z",
  "status": "succeeded",
  "task_id": "crm"
}
