{
  "actor": {
    "agent": "AmpgentResearch",
    "instance": "p18-a",
    "platform": "github-actions",
    "role": "producer"
  },
  "attempt_id": "attempt-0001",
  "extensions": {
    "aosw": {
      "attempt_count": 1,
      "current_task_status": "COMPLETE",
      "derived_from_event_seq": 57,
      "error": null,
      "retry": null
    }
  },
  "graph_revision": "g0001",
  "input_refs": [],
  "output_refs": [
    {
      "artifact_id": "tracking-record",
      "locator": "artifacts/tracking.md",
      "revision": "v1",
      "sha256": "5626e85661b123e7801c852bb5a73ecd5c7699c06113f7ff807f573e53e3f899"
    }
  ],
  "run_id": "run-001",
  "schema_version": "1.0.0",
  "started_at": "2026-10-20T21:11:58Z",
  "status": "succeeded",
  "task_id": "tracking"
}
